{
  "schema_version": "1.0",
  "delivery_id": "MGMT-011-G-1",
  "work_item": "MGMT-011",
  "source_repository": "lywx215/gcli2api",
  "status": "no_counterpart_action",
  "execution_policy": {
    "mode": "queue_only",
    "max_automatic_runs": 0
  },
  "summary": "gcli2api mirrored and reviewed the manager-approved MGMT-011 shared roadmap. The node service has no server-side implementation action for MGMT-011 and did not change provider code, Management API schema, capabilities, Legacy endpoints, credential state, SQLite, or quota behavior.",
  "contract_sha256": "22b1056c134672a1a78e3c1719dcd4806019ae1a2544d0162a27042f3b0884d3",
  "capabilities_added": [],
  "capabilities_removed": [],
  "compatibility": "Management schema 1.1 and all existing capability gates remain unchanged. Modern and Legacy behavior is unaffected because this delivery only synchronizes the shared roadmap; MGMT-011 remains manager-only and must not infer or add active node operations.",
  "tests": [
    "IMPLEMENTATION_ROADMAP.md is byte-identical to the manager-approved file and has SHA-256 11855bc10a8b080617526db5ca71368d51093023eed4ac5458a85cabf03d7610",
    "COORDINATION_SPEC.md and MANAGEMENT_API_CONTRACT.md have identical Git blobs across both repositories and are unchanged in this branch",
    "Handoff schema, queue-only policy, zero automatic runs, sensitive-literal scan, OpenAPI baseline, Legacy-related pytest suite, and repository CI checks pass"
  ],
  "artifacts": [
    "docs/multi-repo/IMPLEMENTATION_ROADMAP.md",
    "coordination/handoffs/MGMT-011-G-1.json"
  ],
  "next_actions": [
    "Record this no_counterpart_action delivery only; gcli2api has no server-side MGMT-011 implementation action, and no other work item is started by this handoff."
  ],
  "generated_at": "2026-08-29T16:10:45Z"
}
